{
  "schema": 1,
  "kind": "nexte-image-block-feed",
  "id": "zh-scanlator-ads",
  "title": "Chinese scanlator ads",
  "algorithm": "dct64-v1",
  "defaultThreshold": 8,
  "updatedAt": 0,
  "items": [
    {
      "hash": "ce9e181d354a3cd5",
      "threshold": 8,
      "label": "scanlator-ad",
      "scope": "whole"
    }
  ]
}
